cleaned_text,Label
istri suka hasilnya bagus,positif
packaging rapi respon cepat,netral
udh abis 4 enak bgtt sumpah tahan bgtt minyak nya kadang kalo dijalan suka ditanyain pake parfum apa,negatif
bahannya ringan pas dipakek di kulit cepat menyerap dan harumnya lembut melindungi sekaligus melembabkan kulit,netral
saya suka sudah beberapa kali ganti tetap balik lagi k azarine brightening c glow serum,netral
sudah setahun pake ini alhamdulillah semoga cocok terus,netral
mntapp,netral
selalalu puas belanja disini takkan pindah kelain hati selamanya,positif
cocok bgt pake semua produk garnier tapi baru nyoba yg water gel ini karna termasuk baru kan yaa jadi semoga cocok juga dan hasilnya bagus,positif
sesuai deskripsi seller ramah dan responsif,netral
muantap,netral
cepet nyerap ga bikin kusam ga perih dimata cocok untuk dry skin,netral
pesanan cepat skli nyampainya packingnya rapi dusx harum banget yg velvet x,negatif
ok aman packing mantap sesuai pengiriman ok jadi tidak ada masalah,netral
dikemas dengan baik pengiriman sesuai estimasi repeat order karena cocok dengan produk ini exp masih lama,netral
warnanya ngeblend sempurna sm guratan alis asliku ga kaya topeng pokoknya hasilnya natural pensilnya yang kecil jd mudah kalau mau mengarsir alis ada spoolinya juga b,netral
baru mau coba semoga dapat mengurangi rambut rontok menyuburkan rambut dan menyehatkan rambut rusak akibat pewarnaan,netral
ga khawatir klo soal kualitas produk pasti bagus pengirimannya juga cepat makasih ya,positif
barang sampai dengan cepat dan pakingan aman,netral
produk original dan sesuai pesanan pengiriman cepat dan packing aman dan rapi,netral
tolong kasih diskon lagi min,netral
keren parahh dapat harga 12rb,netral
kualitas produk bagus wangiiii bangetttttt,negatif
packing aman dan rapi pengiriman cepat,netral
sesuai dan bagus bikin lancar pencernaan,positif
baik,netral
pengiriman cepat dan aman udah 2 kali beli tekstur ringan mudah meresap dan mengurangi iritasi sehabis cukur waxing,netral
kardus penyok2 tp isi aman dikirim sama kurir yg gak glowing,netral
sesuka itu,netral
tidak berfungsi,netral
kualitas produk bagus pancingannya suka banget rapii harum sesuai ekspektasi tapi kok kecil yaa aku berharap yang agak gedean dikit itu tapi ini kecil mana aku suka ba,negatif
barang diterima dalam keadaan baik packing rapih dan aman barang sesuai dengan deskripsi produk fast respon recommended seller selalu puas belanja disini ter,positif
uda sering beli dan cocok banget,netral
respon seller cepat expired masih lama sep 2026 udah gitu dapat bonusnya lagi thanks seller,netral
sesuai pesanan respon cepat proses cepat diterima dalam kondisi baik,netral
bagus dan cocok bikin kulit halus gampang untuk hapus makeup waterproof,positif
mustika ratu merk terpercaya mantap berkhasiat beli 2box beneran hemat lho,netral
baru coba semoga cocok,netral
pengiriman cepat shampoo bayam membantu mengurangi rambut rontok,netral
bahan ringan mudah diserap dan lumayan membantu saat muka jerawatan,netral
dibeli untuk satu paket dengan serum 377 dan moisturizer 377 untuk menghilangkan flek hitam next order lagi,netral
barang bagus hanya saja di pengiriman melebihi estimasi hmpir dua minggu brng bru sampe itu jg hrs lwt komplain,positif
barang cepat sampai,netral
rekomend seller,netral
bahan nya ringan mudah di serap gak whitecas bagus bgt lah pokok nya,positif
enak lembut di bibir tp ga basah berasa moist cma agak salah pilih shade yg temptation untuk bibir yg kehitaman ga cocok warnanya,netral
semga cocokkk,netral
rekomendasi originall,netral
produk datang dengan selamat packaging rapi dan seller ramah,netral
wah paket aku sudh datang aku beli wangi ini kata nya enk bgt dan lgi trend semoga amanah selalu yaaa,negatif
packing rapih cepat sampai mantap betul,netral
ringan tahan lama dan wangi mint,netral
barang diterima dlm keadaan baik sesuai dgn pesanan dapet free gift juga thank u somethinc,netral
anak saya yang laki juga suka tidak lengket di kulit muka,netral
worth itttt,netral
sampai dengan selamat cuma sayang kemasannya kaya lama tapi kadaluarsanya masih jauh,netral
enak apalagi di ruangan ber ac pas awal semprot emang agak nyegrak tapi lama lama engga kok dannn lumayan tahan lama untuk parfume lokall,negatif
bagus banget sesuai,positif
takde cacat atau pecah keren bgt trusted banget gess makeover untuk pengiriman aman trssss cocok dimuka akk yg berminyak jadi mate gtu maap potonya gaada krn bedaknya di,netral
love the color so bright,netral
terimakasih dulu selalu pakai ini mendadak hilang dari supermarket,netral
barang yang dikirim sesuai pesanan dan aman terima kasih,netral
bahan bagus berkwalitas packing paih dan bagus harga terjangkau sangat puas,positif
trima kasih kiriman orderan sy ke 2 cocok untuk sy sedang promo pula,netral
cocok bgt sama kulit aku mudah menyerap bestt bgt,netral
mantul pokoknya semoga cocok dikemas rapih,netral
pasti balik,netral
yeay dapet diskon dapet size besar tapi seharga yg size kecil datengnya cepet banget baru kemarin pesen hari ini datang tengkyu seller,netral
sudah sering co dr official store ini dan selalu puas dengan produknya pengemasan dan pengiriman tergolong cepat terima kasih seller semoga berkah selalu,positif
pesanan sudah sampai varian sesuai pesanan terimakasih seller dan kurir kualitas produk wanginya enaaaak banget,negatif
pembelian ke sekian kalinya emang serum somethinc tuh ngga pernah salah deh luv sekali udah cocok banget kalo mau cari serum super lengkap buat segala permasalahan kul,netral
original sesuai deskripsi responsif cepat aman packing aman,netral
kualitas bagus aku suka banget sama lip serum ini barangnya juga nyampe dalam keadaan aman,positif
katanya po 10 hari tapiiii kmrn baru mesan hari ini barangnya udh sampai luar biasaaa klo kualitas mustika ratu tidak diragukan lagi emang sebagus itu,positif
cepet bgt sampe nya dpt harga 36 rb wangi tp wanginya kurang semerbak cm wangi tipis tipis gak kayak yg velvet rouge,negatif
bahan ringan cocok untuk kulit saya lembut,netral
kualitas barang sangat bagus paket mendarat dengan sempurna semoga cocok,positif
pesanan sudah sampai bagus packing rapi respons penjual sangat baik terima kasih,positif
seneng banget dapet freebies co di 12 12 nyampe nya cepet 24 jam lebih pada exp 2026 harganya semua ga sampe 100 thanks somethinc,netral
teksturnya mate nempel merata di kulit gak bikin berminyak gak bikin jerawat gak gumpal2 kena keringat cocok banget buat kulitku yg sensitif,netral
produk sesuai produknya bagus pengiriman aman amanah sukses selalu tokonya kak,positif
bagus packingnya cepet sampai barang sesuai,positif
cepet banget sih efek ya,netral
barang sdh saya terima dalam kondisi baik thx,netral
barang salah kirim yg dateng hair tonic tapi gpp namanya jg belanja online pasti ada resiko salah kirim semoga lebih baik kedepannya terima kasih,netral
belom d coba semoga bisa nyembuhin jerawat badan,netral
repeat order happy customer good service quality product at affordable price thank you,netral
klo untuk menempel bagus tapi warna ini trnyta terlalu pucat tp memang awet sekali,positif
kurir gercep makasih,netral
barang sudah diterima dalam keadaan baik sepertinya cocok pake serum ini jadi order lagi thanks,netral
sesuka itu ama aroma tonic dari mustika ratu,netral
baguss origainal sesuai warna oke ssipp makasi,positif
dpet hrga 11 rbu mksih brang realpict mantuuuuuulllllllk,netral
abis pake ini tadi berasa glowing dan bersiih yaa sesudahnya hahaha cucooo,netral
warnanya cantik skali dan cocok banget diombre,netral
perdana coba beli powder foundation dan ceraplump ini katena banyak testimoni yang bagus tentang kedua item pas lagi promo cussss beli pembelian produk bagus gini se,positif
semoga ccok baru pakai,netral
mantap sudah sampai barang sampai aman,netral
produk original minyaknya lembut,netral
baguus,netral
wangi minyaknya enak packing aman menggunakan bubble wrap kardus dan pengirimannya juga cepat terima kasih ya seller,netral
mantap,netral
barang yang diterima sesuai dengan pesanan dan tidak ada kerusakan pada barang terima kasih,netral
packing keliatannya aman tp dus nya agak dekok 1 pembelian kedua ga lengket di kulit,netral
enak banget di pakenya dapet harga promo pula pengiriman cepat order malam hari besok sorenya udh sampe bogor,netral
1 sengaja mesen sameday biar nyampe keesokan harinya tapi trnyata baru dikirim 3 hari kemudian tanpa konfirmasi ke customer padahal info dari mereka dikirim di hari y,netral
kualitas produk sangat berkualitas makasih pesanannya sudah sampai dengan aman dan nggak bocor sama sekali dan wanginya flora banget dan ada sedikit sweet puji tuhan dap,negatif
bahannya ringan gampang diserap cocok sama kulit kering aku melembabkan banget favorit deh,netral
biasanya pake velvet rouge euphoria banana fushion yang dimana itu manis semua dan memutuskan cari yang seger plisss aku ambil garden of whisper enak sekalii kaya a,negatif
oke aja sih teksturnya watery tp sedikit kental daripada air pada umumnya baru pakai 2x moga bs menghidrasi kulit,netral
harga diskon,netral
kualitas produk bagus elegan wanginya enak banget ga nyengat pokonya harus punya semua varian 10,negatif
sdh sering beli disini puas,positif
barang sudah sampai respon penjual cepat cuma packing tidak aman kemasan bocor sedikit tks,netral
barang sesuai dengan pesanan semoga muka bisa lebih bersih,netral
selalu pake ini karena maklum sudah mulai ubanan dan malas ke salon cat rambut,netral
bahannya ringan cair gampang diserap kulit cocok untuk segala jenis kulit bagus banget sumpah sunscreen nya,positif
sedikit cerita jadi akutuh beli makeover awal bulan nah baru 1 minggu aku beli eh udah abis tapi emang pas awal buka tuh rada aneh sama produknya pas di aplikasikan ke,netral
serum nya cocok banget di muka dann alhamdulillah dpt promo,netral
pembelian ke2 ini cleanser yang beneran gentle for my dry sensitive skin,netral
sangat efektif meremajakan kulit disarankan menjauhi aplikasi sekitar hidung,netral
alhamdulillah sudah sampai,netral
produk aman packing rapih tektur lipstick creamy dan nyaman dibibir tapi cepat ilang,netral
wangi nya bener2 wangi dh kena air pun gk luntur wangi buah nanas seger kecut gtuh,negatif
suka bgt deh pake ini semenjak rekomend ditiktok,netral
udah pake sunscreen azarine 2 tahun bagus polll gampang diblend teksturnya ringan no white case,positif
pengiriman cepat paket aman terimakasi seller dikasih bonus jg,netral
dapat harga 12k promo 12 12 gratis ongkir pengemasan aman kualitas ok recommended seller,netral
wangi butirannya pas tdk kasar n tdk lembut cocok,netral
pengiriman cepat banget pas di pake ringan banget di wajah langsung menyerap cocok banget buat kulit yang sensitif,netral
barang diterima dalam keadaan baik packing rapih dan aman barang sesuai dengan deskripsi produk fast respon recommended seller selalu puas belanja disini ter,positif
pengiriman cepat packaging rapih semoga cocok digunakan,netral
sukaaaaaaaaaa bangetttttttttt next mau beli lagi,netral
kulit jadi lembab dan halus semoga cocok,netral
lembut tidak lengket,netral
brg dlm kondisi baik packing baik baru mau coba semoga bermanfaat penjual responsive proses n pengiriman cepat,netral
bahannya ringan enak dipake ga terlalu kerasa cenat cenut tapi cocok dipake,netral
mantap amanah,netral
mohon maaf saat ini layanan tidak dapat diakses atau merespons dengan benar mohon maaf saat ini layanan tidak dapat diakses atau merespons dengan benar mohon maaf saat in,netral
mantuuuuul,netral
emang paling mantep dah somethinc,netral
aku beli yang sweet memories wanginyaa enak maniss tahan lamaa pokoknya ada harga ada kualitas tapi di dalem parfumnya ada ga tau apa kaya kertas gitu kecil,negatif
wanginya bener benerr semerbakk banget sukaa dengan wanginyaa baru kali ini beli parfum langsung jatuh cinta sama wanginya next timee order yang lainnn,negatif
bagus tekstur ringan nyaman diwajah,positif
barang cepat sampai semoga dipakai ke muka cocok ga jerawatan,netral
pengiriman cepat produk dlm keadaan aman terimakasih seller sukses selalu,netral
selalu pakai ini bertahun2 wajah bersih dan bersinar pernah coba pakai yg lain sy tdk cocok,netral
pengiriman cepat banget dus penyok gapapa di dlm dus produk dilapisi bubble wrap tipis masih aman kok wangi tahan 6 jam outdoor 8 jam lebih indoor,negatif
kecil2 cabe rawit beads scrubnya halus banget buat digosok di muka abs dipakai nggak bikin kulit ketarik cocok banget buat yang suka tarung sama debu jalanan,netral
aroma nya segar ada manis nya tipis bgt kyk bau2 habis mandi enak g nyegrak di hidung bisa utk cowo atopun cewe best bgt sih ini bakalan repeat murah aroma nya enak,negatif
digambar free hadiah tapi yg datang tidak ada gift atau hadiahnya kalo barang sih tidak diragukan cuma kecewa sedikit karena taunya dapet gift ternyata tidak ada,netral
pengemasan sangat rapi jadi aman sampai wanginya segere banget wangi feminim sekali,negatif
tadinya mau dibawa kerja travel tapi ternyata di dalam botol ada semacam bola jadi berisik kalo gerak admin tokonya perlu paham produk mereka sendiri dan jaw,netral
barang sesuai kirim sangat cepat exp 2027,netral
pembelian ke 2 karena cocok disaya makanya beli lagi,netral
enak ringan di bibir warnanya bagus stainnya lama pokoknya bagusss deh,positif
bagussss,positif
ko yg dateng nya sunscreen set yaa,netral
dan yaaahhh seniat ini sih mau cobain smw variant prfm scrlett tester nya ada 3 yg kebuang klo aku rate sih 1 banana fushion bau seger ga eneg maju mundur mau beli k,negatif
tonernya enak semoga bisa mencerahkan kulit aku gak ada bau aneh aneh gak lengket juga ingredients bahan aktifnya oke banget,netral
baeang sudah sampai kondisi bagus senoga hasilnya bagus,positif
mantapp wanginya enak dpt hrgaa murah jg hhhi thx next order lg,negatif
barang dtg siang malam lgs ku pakai paginya kemerahan di muka agak berkurang mantap,netral
lagi coba ganti varian karena biasanya pakai bengkoang,netral
puas barang dikirim sesuai dengan harga terjangkau terima kasih juga giftnya,positif
sesuai,netral
suprisingly paketnya datang sesuai tanggal estimasi terimakasih seller terimakasih courier services,netral
barang ori 100 dan super aman dikasi bubble wrap tebel dan kardus jadi paketnya sangat amannn,netral
gak pernah kecewa sama azarine yang satu ini dri dulu mantep polll,netral
barang yg datang sesuai dgn deskripsi dpt digunakan pada kulit yg terdapat noda kemasannya baik tekstur cocok utk kulit,netral
pengiriman cepat expired september 2027 semoga cocok nanti langganan,netral
aku beli yang aqua essence city defense sunscreen itu karena dia claim water resistant ya tapi kayaknya cuman sampe level cipratan2 air atau keringet mungkin ya karena w,netral
mksh sdh terima maaf lupa difoto brgny warnamya mmg biasa dipakai,netral
barang sesuai deskripsi packing aman pengiriman cepat salah satu parfum fav wanginya segar gak kalah sama parfum mahal,negatif
barang sudah sampai diterima dgn baik sesuaii belum dipakai sih semoga cocok cocok aja packaging okk pengiriman okk overall okk sihhh expired juga aman thankuuu,netral
pengiriman cepat produk sesuai harapan transaksi baik,netral
terbaiiiiiik,netral
cakep bgtttt gilaa tapi untuk kulit kering coveragenya kureng,netral
wangiii,netral
mengcover dengan baik ringan cocok dikulit saya sudah lama pakai produk ini,netral
wangi banget suka laaa cuman sayang ko isian nya ga full ya,negatif
barangnya cepat sampai kondisinya baik expired nya jga masih lama tahun 2027 sesuai dengan pesanan n30,netral
ringan gampang diblend pake tangan juga bisa light coverage finish natural my skin but better,netral
barang sudah sampai sesuai aman terima kasih,netral
scarlett tau aja klo mancing orng beli di ksh free body serum 7ml buat cobain lngsung suka sm wanginya udh dpt hrga murah boleh kali lh next free parfum mini biat cobai,negatif
sudah diterima dengan baik tidak ada kendala,netral
udah sering beli disini dan emang sebagus itu dan approved banget sukses selalu originote is the best,positif
saya beli tgl 9 des estimasi barang sampai tgl 15 des dan barang sampai di tgl 17 des setelah saya komplain ke tokopedia mengecewakan beli di toko ini,netral
cepet bgtt pesen kemaren besoknya datang,netral
wangi semerbaxx asli yg garden sukaa bgt beda sama yg lain,negatif
kiriman,netral
bahannya ringan lembut pokoknya mantap dah,netral
asli minyaknya kemasan rrapi,negatif
sesuai pesenan semua nya oke wanginya enaken,negatif
cocok banget repeat order mulu emang selalu pake garnier,netral
pengiriman produknya aman tidak ada kerusakan warnanya sesuai ekspetasi banget dan tekstur lipstick lembut dan creamy gitu,netral
barang cepat sampai seller responsif dan ramah memuaskan puas belanja di sini,positif
wangi nya benar benar enak bgt mewah seperti parfume dubai perbaduan wangi yang susah di dapatkan dan tahan lama wangi nya kualitas produk sangat baik,negatif
mantab sesuai pesanan barang nya dan cepat pengiriman nya,netral
pengiriman cepet 2 hari sampai ok mantap,netral
wangi enak kalem gt wangi nya gk nyegrak dihidung gatau brp lama tahan nya kalo dipake diluar ruangan ini apa emng ga full ya isi nya hehe,negatif
cleansernya keset serumnya watery bgt tapi dapat gratis produk rambut lumayan lah,netral
produk sesuai pesanan packing rapi semoga cocok dengan kulit saya dan kel,netral
sesuai thanks,netral
mantuull pokoknya toko langganan aq klo beli selaluuu disini makin sukses yaa lancar usaha dan rezeki nya aamiinyaaallah buat abang kurir nya jg dah langganan,negatif
suka sama wanginya ada manis manis dikit packing juga aman banget ga bakalan takut bocor atau rusak mantull pokoknya,negatif
pengiriman cepat dgn harga promo trimakasih,netral
udh repeat order mulu tandanya ya emang bagus,negatif
paketan ny udah datamg bau nya harum bangett nanti mau co lagi yg biru samudra maoasih toko nyaaksih tik tok maksih mas kyrir nya,negatif
pengirimannya cepat pengemasannya luar biasa aman rapi,negatif
cocok di wajah saya dan memuaskan hasilnya saat memakai dgn rutin dpt gift lucu dan sangat bermanfaat giftnya tx seller,netral
alhamdulillah paketnya sudah sampe rumah pengiriman lumayan cepat yaa barang sesuai dengan yg saya pesan paking rapih dan aman terima kasih banyak,negatif
pesan 3 dtang cman 2 d complain ktanya video gag unboxing dare awal buat apa sya bohong toh hanya parfum harga 50rbuan d cctv scarlet official nya ada yg cek en ricek ga,negatif
kulit makinc erah,netral
so good barangnya jg sampai cepat,netral
curang bonus 30gr gak di kirim sebelum order sy sdh tanya jwb nya ada bonus 30gr gak berkah,netral
no white cast,netral
dari segi packaging nya rapi untuk aroma belum mencoba dan semoga awet pokoknya suka dehh,negatif
barang sudah diterima dengan baik dan sesuai description,netral
wangi nya enak manis seger cocok buat first date atau ngedate sm cowo,negatif
lipmatte kecintaanku dari warna tekstur awet nya juara bgt tiap beli pas bgt lagi diskon sukses terus makeover,netral
mantap sekali recomended produk berkualitas,netral
semua produk airnya rembes sebagian,netral
paket sudah sampai respon penjual cepat pengiriman jg cepat packing aman aroma wanginya enak next order lagi terimakasih seller dan abang kurir,negatif
paket sudah tiba barang sesuai pesanan pengiriman cepat kurir sdh langganan pokonya recomended,netral
packing aman rapi pengiriman sesuai yang dijanjikan mudah mudahan cocok,netral
woww warnanya cakep malah dksih bonus serum terbaik,netral
sesuai order thx seller,netral
barang bagus sesuai foto packingrapih kurir ramah,positif
thanks scarllet bismillah lancar rezeki aku biar bisa repeat orderrr,negatif
suka banget sama bedak segitiga itu ngeblend d kulit seller fast respon,netral
sekaligus beli 3botol jadi murah rambut subur cepat panjang tp ga ada yg tumbuh baru wkwkkwk,netral
kualitas sesuai deskripsi sudah yg kesekian kali repeat order dgn warna yg berbeda krn mmg sebagus itu,positif
kualitas barang jelek packing tidak rapih entah penanganan kurir jelek atau penjual kurang teliti iasanya beli nkrmal tidak ada masalah barang ada yang rusak,netral
seperti biasa response penjual cepat packing aman good job,netral
ini moisturizer pertama kali langsung cocok dan tanpa ragu juga bakal refill lagi sih,netral
barang sesusai harga n kwalitas bagus respon n delivery cepat,positif
barang sesuai deskripsi seller quick response dan pengiriman lancar jaya thanks,netral
sesuai pesanan jumlahmnya cocok tinggal pakai aja,netral
produk sampai sesuai estimasi produk dalam kondisi baik produk sesuai deskripsi picture,netral
suka,netral
air mawarnya paling suka deh mksh,netral
bagossss,netral
endulbat ini produk,netral
lumayan banget dapat free 3 sachet serum pagi dan serum malam ini,netral
sudah coba yg mate cushion skintific warna biru dan hasilnya bagus ini baru mau coba foundationnya semoga cocok,positif
terimakasih pengiriman cepat dan dapat gratisan,netral
mantapp,netral
cakep banget,netral
ntaps,netral
bagus banget bikin segar d wajah gk lengket gk menyebabkan iritasi,positif
warnanya cakepppp,netral
lembut melembabkan kulit wangi di kulit isi banyak,netral
packing rapi sampai cepat produk sesuai deskripsi bahan ringan,netral
warna bibir tp sedikit lebih tua cocok banget utk sehari2 ga perlu tebal2 bisa tahan seharian lipstik anti tsunami kesayangan banget sudah punya 4 warna 04 10 11,netral
sdh cocok paje garnier varian ini kulit muka terasa bersih n cerah beli lg buat stok mumpung promo makasig,netral
exp date masih ada sisa 1 thn dapat promo buy 1 get 1 pcs masker terasa halus dan terasa glowing di kulit stlh pemakaian semoga kinclong dech,netral
sayangnya warnanya terlalu pucat untum istri saya,netral
baguss warna nyaa,positif
padahal pengen paket ini tapi paket nya tidak ada kurir nya nya salah kirim dan tidak nyampe ke alamat saya,netral
wangi sekalii cuman ga begitu strong kaya yang golden elixir,negatif
respon seller cepat dan ramah packing rapi recommended seller,netral
produk asli harga murah pengiriman cepat,netral
jolly velvet purple wanginya beneran enak banget,negatif
pengiriman cepat,netral
suka sama warnanya packing nya juga safety bgt,netral
thanks gift nya somethinc packaging aman barang yang dikirim sesuai produk belum dicoba but overall so so good,netral
langsung menyerap di kulit gak bikin iritasi oke banget lahhhhg,netral
barang jelek pengiriman tidak aman kemasan rusak,netral
suka bangetttt sama wanginya kalo di luar ruangan lumayan lama awetnya,negatif
bahan ringan mudah diserap dan pastinya cocok sama kulit mukaku,netral
seller langganan barangnya sesuai packing aman dan pengiriman cepat,netral
cocok diwajahku,netral
paket telah diterima dengan aman dan sesuai pesanan thanks reseller and godjob,netral
mon maaf ini mah saya kasih bintang satu masalahnya saya beli parfum dateng nya body lotion parah bet dah mana lupa ngevidioin dikira bakal sesuai ekspektasi ternyat,negatif
pas pesanan sampai ga tau kenapa beda sama yg aku pakai sebelum sebelumnya padahal sama euphoria nya pas dicobain juga wanginya ga sewangi yg aku punya sebelumnya dilih,negatif
sperti biasa mantap,netral
paket sampai dengan selamat pengirimannya cepet banget wanginya enak banget soft seger gak bikin pusing,negatif
kualitas produk yang ini wanginya bener bener kyk siap mandi seger banget,negatif
sabun muka oke banget tapi sayang toner salah kirim,netral
barang sampai dengan aman dan tidak cacat karna ada bubble wrap bedak favoritku warna kulit muka kuning langsat jadi milih yg maple biar ga terlalu putih atau coklat s,netral
alhamdulilah paket sudah sampai pengemasan nya rapi safety banget biar ga rusak dan costumer puas dapat harga murah plus aromanya yg seger candu banget dengan wanginya b,negatif
parfum nya oke wanginya tahan lama dan pengemasan nya bagus wanginya cocok untuk cewek krna wangi vanilla,negatif
barang sampe dengan sesuai response cepet dan dikasih bonus,netral
sudah pakai sangat sering untuk produk ini sangat membantu penampilan yg lebih tahan lama sangat cocok dengan jenis kulit muka saya yang variasi teksturnya sangat lemb,netral
kualitasnya bagus lembut dan melembabkan kulit saya memakai sabun zaitun cocok untuk kulit saya mustika ratu memang,positif
sudah sampe paketnya parfum nya wangi seger manis gitu scarlet its the best toko nya amanah terimakasih toko terimakasih bang kurir,negatif
pengiriman oke cepat produk sampai dengan aman tekstur gel dan mudah meresap mari kita coba si produk best seller ini semoga cocok,netral
dari yg dulu kena badai jerawat disarankan dokter pakai produk yg beredar dipasar aja jgn yg di klinik alhamdulillah sembuh bener dan lbh murah,netral
cocok sesuai pesanan,netral
wangi nya manis enakkkk dan untuk harga segitu worth it karna ketahananya lumayan lama nempel terus di baju good,negatif
bahanya ringan mudah diserap sdh lama pake mantul pokoknya,netral
bahan ringan mudah diserap buat cowok juga ok apalagi pada masa pertumbuhan wajah jadi lembut tidak kasar,netral
beli semua parfum scarlet dengan variam scent aroma parfum yg ada beberapa yg aku belum coba harga ekonomis tapi gak murahan dari tampilan dan aromanya yuuuksss d,negatif
tahun 1997 saya minum sangat pahit and its works sekarang tahun 2024 saya jadi sedikit agak berlemak semoga bisa berhasil walau taste tidak seperti dulu yang sekarang,netral
perfect bagus pol,positif
dapat free thanks garnier,netral
barang sampai sesuai estimasi waktu kondisi barang ok waktu expiry nya juga masih lama 23 03 2027 mantap terima kasih,netral
seller fast respon pengiriman cepet produk ori dan bagussss bangetttttttttttt kemasannya mevvah warna nya bagusss banget trs ga lengket ini cuma 1 lapis pakenya ta,positif
luar biasa memang produk ini gaperlu ragu,netral
paket sampai dengan aman bubble wrap tebal sudah langganan merk azarine hanya produk nya yg beda2 thankyou azarine tokopedia jasa antar,netral
baru coba bedak nya terima kasih seller dan tokopedia,netral
mantap pengirimannya sangat cepat,netral
selalu pake garnier apalagi kl lagi disc,netral
dapat pas harga murah,netral
rekomen sekali untuk handbody wangi dan nyaman dipakai,netral
barang sesuai saya suka belanja di sini top dah pokoknya mantap betul jos sip,netral
