cleaned_text,Label
packing aman sesuai pesanan cocok utk d kulit yg sdh after fifty to sixty gercep bangeet malam pesan besoknya sampai trima kasih seller kurir tokped sukses,netral
terasa ringan di bibir warna tahan lama,netral
bahannya ringan gampang diserap warnanya bgus bgt dibibir aku lembab,netral
suka bgt dengan wangi biru samudra stlh menjelajah semua wanginya yg paling suka si biru pokoknya si biru best lah bagi kuh terimakasih scarlett dan tiktok,negatif
saya sangat puas,positif
highlighternya bener2 sekali usap sudah keluar banget hasilnya nampol abis waktu dicoba terlalu tebal sampai agak susah untuk dibersihkan jadi next cukup 1 kali usap s,netral
respon baik barang sesuai,netral
alhamdulillah cocok pakai ini sudah 3 tahun packingnya aman terima kasih seller,netral
terima kasih giftnya,netral
makasi ka cepet banget pengirimannya paket aman sesuai orderan,negatif
lipstik andalan sejak dahulu kala warna bagus ngga mudah luntur ngga bikin bibir kering,positif
cocok banget buat kulit skskskksjsjsjsjsksksk,netral
cepet nyampenya dan kita coba dulu ya apa bagus atau tidak nanti di kabarin lagi,positif
very fast respon barang datang sesuai dengan pesanan packing mudah2n aman karena pake bubble wrap juga,netral
wangi banget pengiriman lumayan cepet untuk ketahanan kurang tau semoga aja tahan lama awalnya ragu karena ada yang bilang wangi nya kaya bapa bala jum atan pas s,negatif
original dan packing aman,netral
terima kasih barang diterima dengan baik kualitas barang baik pengiriman cepat,netral
salah pesen niatnya powder foundation ternyt creme foundation aq fikir lengket dempul ternyata ringan bgt lmyn bs nutup flek di muka nyaman jg dipake utk h,netral
cocok untuk semua jenis kulit tekstur nya ringan,netral
ada endapan di leher botol dan warna nya keruh,netral
ini gift sih dikulit saya yang berminyak sangat cocok dan enak dipakai simple dan cepat menyerap juga,netral
barang datang dengan selamat dan sesuai,netral
thanks,netral
bagus banget finishingnya buat muka ga kaya dempul dan belang,positif
produk original skintific semoga istri senang dan cocok terima kasih seller dan kurir sukses selalu,netral
mantap pengiriman sangat cepat barang ori hg murah wangi lg best pokonya scarlet,negatif
pensil alis nya pigmented bgt dan cocok buat pemula,netral
pesanan sampe dgn aman tapi setelah pemakaian 1 minggu ternyata gak cocok dikulit saya muka saya jadi bruntusan,netral
super bagus bangett aku udah make ini hampir setengah botol rambut rontok jadi berkurang merangsang pertumbuhan anak rambut aku yg bertaun taun botak di depan sekarang,positif
mantap pengiriman cepat sukses selalu lapaknya,netral
pesanan sudah sampai dengan pengiriman yg cepat,netral
warnanya terang untung cocok di skintone saya,netral
baru mau coba hehe,netral
wangi,netral
respon cepat pengiriman cepat biasanya saya pake cleanser balm karena klo pake micellar water suka kering tapi pake ini nyaman banget dan berasa bersihnya,netral
paketnya sudah dateng walau kardusnya agaknrusak tapi dalemnya masih aman produknya cocok di aku suka pakenya nyaman juga di kulit tidak lengket terimakasih,netral
paketnya sdg dtg seperti biasanya pengiriman cepat dan emang semua parfum scarlet recomend semua saya sdh punya beberapa dan yg banana fusion juga ga kalah wangi next ord,negatif
product yang ditawarkan sesuai respond penjual cepat tanggap yang pastinya tidak kecewa jika beli disini,netral
pembelian yng ke 3 okey,netral
pengiriman cepat sekali mantap,netral
repurchase kesekian kali karena sesuka itu sama ss azarine seneng banget pas tau ada ukuran besarnya,netral
great customer service,netral
bahan nya ringan gampang meresap terus barang nya itu cepet banget datang nya 2hr udh dateng,netral
barang sesuai deskripsi fast response recommended seller,netral
sejauh ini sunscreen favorit ringan mudah diserap dan ndak ada white cast,netral
cocok banget buat base ombre paling masuk ke semua skintone menurutku tapi tetep harus lip prep pakai lipbalm lip mask karena lumayan bikin kering di bibir terutama untu,netral
cakep banget warnanya sayang california ternyata pucat tapi bisa dipakai sebagai base ombre di foto hallway atas tengah california bawah vixen dibikin juga kalau jad,netral
packing rapi dan aman pake bubble wrap wanginya soft banget suka,negatif
good produk good price,netral
untuk sejenis lippen glossy yg tahan banting ini yg paling ringan drpd merk lainnya,netral
kualitas produk biasa aja tulisannya extrait de parfum tp baunya ga tahan lama mending parfum isi ulang malah lebih tahan lama,negatif
wanginya enak bangettttttttttt tahan lama banget pokoknyaaa gausah ragu mau beli produk scarlettt meskipun ini po tapi cepet banget woyy datengnyaaa,negatif
murce dapet diskon jd cuma 24 5rb aja belum tau bagus ga soalnya biasa pake yang ijo mau coba yang ini,positif
barang sesuai pesanan,netral
barang sesuai pesanan cocok buat yg bibir kering hasil glossy alami,netral
parfume nya wangi polll pertahan kan kualitas parfumnya the best sihhh scarlett ini,negatif
makasih kak cocok dan bagus dipakainya,positif
baru mau coba yang peeling solution dari skintific semoga cocok,netral
barang sampai dgn aman tanpa penyok,netral
alhamdulillah parfum kesekian wanginya sedep selera aku 11 13 sama sweet memories velvet tapi sayang 1000 sayang cekot 2 kebelakang ini isi parfum cukup berkuran,negatif
sip,netral
produk ori dan dapat diskon packing aman dan rapi,netral
barang ori kemasan bagus pengiriman cepat puas bgt mana dpt harga diskon mantap,positif
super gercep sprti biasa seller ramah warna pas bngt dikulit mksh yaa,netral
sudah repurchase ke 2x dan sejauh ini cocok dan enak bgt di kulit aku yg berminyak dan berjerawat memudarkan bekas bekas jerawat tp dikit wajar karena ini cuma toner da,netral
ringan di kulit tipe combination sensitive ditimpa make up juga gak bikin longsor,netral
bagus banget coverage nya dan shade nya cocok dg kulit ku,positif
tahan lama bgt pake lipstik ini tp ttp glossy dpake makan juga masih stay cantik warna maroon nya cocok untuk ombre atau pun ga di ombre,netral
alhamdulillah paket nya sudah sampai pengiriman cepat dan packing rapih amann dan barangnya sesuai,negatif
proses cepat pengiriman cepat packing aman,netral
cs nya membantu banget pilihin shade dan emang cocok masalahnya pengirimannya walau udh pake bubble wrap tetep ada retak di bedaknya,netral
pembelian ke 3 tp kali ini yg ukuran 80gr,netral
wanginya masih oke cocok untuk rambut rontok ku semoga ampuh pemakaiannya gampang,netral
udah lama gak pake body butter mustika ratu dengan bau yang ini jadi aku pesen yang ini wangi bunga lily dan madunya terasa banget kulitnya jadi lembut banget kemasan,netral
bagus kemasan nya bentuk pensil brow nya bagus,positif
harga paling murah dibanding toko yang lain pengiriman cepat barang sesuai foto,netral
mantab barang sudah sampai thanks smoga makin sukses,netral
jujur baru kali pertama beli mo powerstay dan belom coba juga jadi belom tau kalo dipake di kulit medium netral undertone kayak apa moga bagus dan ga bikin pucat emang,positif
paket minyak zaitun nya udah sampai minyak nya wangi semoga cocok untuk wajah saya ya m,netral
tahan lama,netral
secinta itu sm make over glazed tahan lama bgt sampe punya 5 shades yg 1 shades dna udh abis jadi kubuang ini dapet shades d11 d16 cuma 150k hahahaha,netral
dapat harga diskon sangat melindungi kulit dari sinar matahari,netral
barang diterima lamaaa barang lain y diorder pd tgl tsb sdh lama diterima ada 3x pengembalian k sumur bandubg knp ya ga pnh spt ini paket ama kurir ditaruh diatas pi,netral
bagus dibuat oleh manusia dan hewan lainnya makanan hewan kucing dan hewan lainnya makanan hewan kucing dan hewan lainnya makanan hewan kucing dan hewan lainnya makanan h,positif
beli ke 2x nya cocok untuk kulit wajah makasih ya dapat bonus juga,netral
enak banget ringan ngga bikin cemang cemong keputihan,netral
warnanya persis yang kumau semoga nyaman di bibir gak bikin kering,netral
real pick pengemasan nya sangat baik kualitas produk bagus,negatif
micellar water dengan daya pembersih terbaik,netral
terbaik barang ori packing aman banget,netral
wow this lipstick is truly the bomb very nice texture and the color really stays thanks,netral
wanginya enak dan tahan lama,negatif
pesanan sesuai alhamdulillah dapet free produk lagi moist ini sangat cocok di aku pas aku kasih tau temen kalo dapet free produk langsung pada minta coin,netral
kualitas produk kualitasnya bagus saya emang selalu pake produk scarlet dari akhir tahun kemaren kali ini saya videoin unboxingnya soalnya kemaren ada kejadian yg kur,negatif
sesuai walapun gk terkirim,netral
bagus produknya berkhasiat sesuai dengan iklannya cocok untuk semua jenis kulit recommended,positif
ini sudah yang ke dua kali saya beli beneran bagus produk nya cocok juga untuk olah raga tidak perih ke mata kalau kena keringat cara aplikasi nya simple,positif
datang tepat waktu warna sesuai yg di minta,netral
kualitas produk oke pengiriman tepat waktu kurir ramah seler baik fast respon ramah banget pengemasan oke bnget pokoknya aman bnget deh pke plastik tebel abis itu p,negatif
harga nya murah bangetttttt,netral
respon dan pengiriman yg cepat tq,netral
kualitas mustika ratu emang the best dan pengirimannya cepat sekali puas bgt belanja disini,positif
cepat banget meredakan jerawat mantapp,netral
barang sesuai ga sangka cepet banget sampenya bener2 recomended,netral
bahannya ringan dipakenya langsung meresap terimakasih seller,netral
ok good,netral
baguss packaging aman barang cepat sampai dan gak ngecewain suka banget wanginya persis sama wangi body lotion yang jolly nya juga,negatif
alhamdulillah produk sampai dengan baik terimakasih,netral
pliiissssssss wanginya enak parah yg dreamy kaya jasmine teh yg velvet manis,negatif
pesanan sesuai dan cpt sampainya mksh,netral
barang sampai dalam keadaan baik packing nya aman barang sesuai deskripsi bagus dan harganya sangat bersaing respon selker cepat pengiriman tepat waktu next b,positif
sesuai dengan diskripsi,netral
paket telah diterima dengan baik thanks garnier dan toped diskon diperbesar lagi lah,netral
parfum kecintaan akuuuu aku tipe orang yg susah banget nyari prfum yg pas di aku soalnya aku suka enek mual bikin kepala pusing bau parfum yg ga pass dan fina,negatif
,netral
pesanan sudah sampai cepat sekali pengirimannya terima kasih,netral
suka banget sama sampo ini ngurangin rontok kulit kepala juga jadi ga berminyak,netral
bagus banget sesuai dengan yang di pesan cuma dapat harga segitu saja ga nyala banget dapet sebagus ini,positif
barang original packing rapi,netral
bagus,positif
ringan dikulit ngga berminyak langsung meresap ngga lengket,netral
mantappp dah bau nya wangi bangettt,negatif
barang sudah diterima pengiriman cepat sampai tujuan terima kasih,netral
kritik pelayanan baik pengemasan aman sampai tujuan pengiriman tepat waktu dan produk sesuai dengan deskripsi saran tetap ditingkatkan pelayanam pemgirman dan,netral
packing aman pengiriman cepat mudah pengaplikasian,netral
best fasial soap recommended,netral
bau nya enak bangett,negatif
tekstur ringan cocok untuk kulit berjerawat awalnya ragu buat check out takut yang dateng ga sesuai ternyata yang dateng bener asli mana murah banget dapet harga,netral
pengiriman cepat dan tepat waktu harganya oke dapat diskon packing aman dan rapih kurir sopan expiry date produk masih lama makasih,netral
keren,netral
wanginya mewah dan nempel banget aku suka harganya pun murah tapi kualitas gak kaleng,negatif
bagus untuk kulit,positif
awalnya sih ga mau beli produk lokal soalnya banyak yg overclaim tapi berhubung somethinc trmasuk yg bagus dicoba beli eh bneran bisa bikin calm kulit yg lagi gatel2,positif
goooddddddd,netral
pas habis bgt pesen dan delivery cepat itu memuaskan,netral
belum coba semoga sebaik varian lainnya,netral
meremajakan kulit wajah packing aman respon cepat,netral
paket datang dengan selamat sudah cocok pakai sunscreen azarine mudah2 an selalu dapat promo,netral
packingan rapih pengiriman cepat,netral
kualitas produk bagus harga produk bagus pengiriman bagus makasih seller,positif
baik enak wangi semprotan bekerja dg baik,netral
semoga cocok baru pertama kali pake soalnyaa,netral
pesenan udah sampe dengan aman dan selamat packingnya juga aman karna pake bubble wrap barangnya ga ada yg cacat ga ragu soal keasliannya kalo disini mah makasih sell,netral
barang sudah sampai dengan selamat pengiriman cepat tanpa cacat terima kasih,netral
packingannya amann pollll parfumnya mevvah bgt wanginya oooey jd pengen cobain semua variannya,negatif
its not plumping and a bit sticky as for the moisturizing part i am not yet sure,netral
baru beli ini semoga bisa menurunkan bb gara lutut makin ngilu kalo jalan keren seller pengiriman express abiss terimakasih banyak,netral
wrn tdk sesuai lbh light lbh pinky lbh glitery tdk sesuai dg ekspektasi,netral
mantapp wangiii bgttt sampe org pada nanyaain wangii darii manaa nihh packingg jugaa amann puolll bakal jadi parfum kesayangan nih,negatif
bahan ringan gampang diserap cocok,netral
bahan ringan mudah meresap harga terjangkau,netral
barang sesuai dengan deskripsi pengiriman cepat pengemasan barang bagus terima kasih,positif
suka sama warnanya tp teksturnya buat saya terlalu cepat ngeset dan after nya terasa sedikit kering waterproof nya bagus dipake makan masih ada tp ttep perlu touchup d,positif
pengiriman lama banget padahal ada di rmh tp dibilang ngak ada di rumah,netral
kurir ramah dtg cpt produck sesuai pesanan toko ny amanah sering kasih promo sllu jd langganan terbaik utk produk scarlet ny kualitas produk baik original trims y,negatif
barang aman sesuai deskripsi tektur cair tidak iritasi,netral
sdh repeat order kesekian kali barang sdh diterima dlm keadaan baik respons penjual super cepat trimakasih,netral
cocok dgn kulitku lembut dan lembab di kulit tidak bikin iritasi,netral
n30 kehitaman di kukit saya n20 keputihan di kulit saya jafi yang tengah2 nomor berapa ya terimakasih,netral
pakenya tipis banget di bibir aku soalnya kalau ketebelan kurang cocok di warna kulitnya yang undertonenya neutral dan skintonenya kuning langsat kalah dipakai tipis ja,netral
alhamdulillah paket sdh d trm dengan baik semoga cocok seallerny ramah insyaallah pasti pesan lagi kwalitas produknya sangat baik warna ny bagus d pakai d bibir sang,positif
cocok untuk kulit sensitif acne prone facial wash yg ringan juga,netral
mantap ini wangi danbermanfaat buat suburin rambut,netral
tipe kulit aku yang berminyak setelah pake itu tidak terlalu oily teksur serum nya kental dan cocok di muka aku,netral
tdk sampe 24 jam sdh tiba,netral
bagus samapainya juga cepat,positif
barang lengkap sesuai deskripsi,netral
warna nya bagus bgt sukaaaaaaa seller amanah dpt free 2 barang tp g tau dari yg mana,positif
smooth dipkenya warnanya keren tahan lama juga,netral
bahannya ringan tahan lama cuma warnanya lebih gelap ketika dipakai di kulitku tapi overall bagus,positif
suka sii ringan tp shadenya shade yg paking ak benci huhu padahal di vt2 ak liat tuhh nude bgt trnyata pas dipake gonjreng bgt,netral
kemasan rapi dan aman toko langganan kalo beli pembersih muka buat istri,netral
mantappp dapet harga murcee parah thxuuu diskonnya tokpeddd,netral
pengiriman cepat packingnya juga bagus tapi tidak ada puff nya,positif
repeat order cocok untuk kulit ku yg cenderung kering lembut n wanginya tahan lama packing aman pengiriman cepat sesuai estimasi waktu,netral
baguss bangett pokoknya,positif
mantap dapet diskonan yeayy,netral
sesuka itu sama perfumnya wanginya suka banget awet lagi dan kebetulan lagi dpet promo murah bgt cm 20rbuan maaf isi parfum udah ngg pnuh krna udh dipkk berkali2,negatif
produk sesuai pesanan secara gambar tidak jelas tp untungnya masih sesuai warna yg diinginkan,netral
warnanya cocok buat cool tone terlalu gelap kalau untuk warm tone,netral
wangi kualitas baik digunakan untuk urut,netral
barang sesuai bagus pengiriman cepat kualitas original,positif
barang sesuai reapon cepat pengiriman cepat,netral
sudah tidak diragukan pagi kualitas masker bengkoang mustika ratu dulu ya sempat pakai rutin sampai kata teman2 kok jd glowing kulitnya,netral
ringan di bibir lumayan tahan lama juga kalo dipake makan ga ilang warnanya menyala bgt say,netral
bahan ringan mencerahkan cocok untuk kulitku sensitive,netral
bagus sesuai,positif
barang sesuai foto dan deskripsi cocok untuk kulit sensitif cepat menghilangkan jerawat pengiriman sangat cepat,netral
bagus banget wangi asli cuy langsung aja di co ga perlu banyak tanya,positif
udah repurchase ke 5x nya sangat memperbaiki skin barrier kalau kulit lagi kering,netral
ga nyangka beli moist pas 12 12 dapet harga promo free serum full size 15ml dan yg kecil itu,netral
produk sesuai tekstur lembut di kulit tidak lengket di kulit,netral
dapat harga di 25 rb saja diskonya bener2 gede banget semoga wangunya awet ya,negatif
ringan banget gak bikin bibir berat salah beli shade tp gpp tetep dipake kok next mau beli shade yg agak terang pengirimannya jg cepet padahal hari ini libur pilkad,netral
barang diterima dalam keadaan baik respons penjual cepat sesuai dengan yg dideskripsikan rekomendasi sekali beli disini terimakasih,netral
prosesnya cepet satu hari udah sampe semoga cocok di aku,netral
wangi nya enak banget pengemasan ny pun double diks sih wangi nya kyk parfum sotb versi murahnya,negatif
pengirimannya cepat lumayan dpt diskon,netral
harganya terjangkau terus engga teksturnya juga nyaman dipakai,netral
wangi udh langganan parfum scarlett udh coba semua varian tapi sayang yg euphoria isinya kurang 30 ml padahal gk ada yg tumpah,negatif
sesuai pesanan dan deskripsi pengemasan aman pengiriman sesuai estimasi expdatenya msh lama,netral
sukaaa bangettt wangiinyaaaa loppopp cocok bgttttt next order lagiiii,negatif
sesuai pesanan kiriman cepat paking bagus,positif
terimakasih barang sesuai dengan pesanan waktu sampai sesuai estimasi,netral
baru coba pertama kali semoga cocok,netral
wangiiiiii bgt mantapppppppp keree,netral
cakep bangeett lipstiknya puas,positif
awal skeptis sama produk ini krn selama ini make brand lain yg seharga ga pnh ada yg sreg tp pas sebulan pake tnyta ini eye cream paling ok gampang menyerap tekstur r,netral
makasih orderanku sudah sampai dengan selamat baru kemaren pesen harga ini udah nyampe seperti biasa wanginya istimewa makasih juga kurir yang nganterin pad,negatif
bagus,positif
respon cepet packing ok rasa belum dicoba semoga tambah sehat,netral
bahanya alami dipake enak wangi gak lengket mantappp,netral
pembelian kesekian kalinya,netral
saya kecewa bgt kali ini sama scarlet saya pecinta parfum scarlet bgt udah 1 tahun lebih dan banyak bli varian parfumnya dan sekarang saya coba yg baru ternyata spray,negatif
cocok dan favorit banget dengan produk dari make over warnanya cantik tahan lama mengcover sempurna warna bibir gelap tidak membuat bibir kering,netral
terimakasih pesanan sudah sampai dan sesuai pengiriman cepat wanginya kalem dan tahan lama mantap,negatif
tonicnya besar juga ternyata keren mustikaratu,netral
aman terimakasih,netral
pengiriman sangat cepat terimakasih seler,netral
tekstur ringan packing rapi dan aman lembut dikulit,netral
barang sesuai sudah sering pakai enak bgt kulit jd halus,netral
waktu pengiriman yg normal paket sampai dengan aman dan rapih waktu pengiriman yg normal paket sampai dengan aman dan rapih waktu pengiriman yg normal paket sampai d,netral
bahanya ringan gampang diserap wangi,netral
bagus banget ngecover banget noda kehidupan,positif
udah pembelian kesekian kalinya dan emangs sesuka itu sama crayonnya makeover apalagi buat ombre,netral
sudah langganan,netral
bahannya cocok dengan kulit dan sudah langganan,netral
cskeepp,netral
my favorite lokal brand for setting spray,netral
shade nina ketahanan gatau yaa semoga longlastingg hahaha baru mau cobaaa,netral
pengiriman cepat dan barang mendarat sempurna,netral
wangi bggtttt kualitas produk bgs,negatif
wanginya segerr pertama kali spray yang kecium di hidung aku itu fresh clean dan dominan citrus cocok untuk daily dan aman banget dipake siang hari,negatif
mendarat dengan baik semoga cocok,netral
paket tiba dengan kondisi baik barang exp masih panjang,netral
packing aman barang ok pengiriman gercep sempet baca ulasan ada yg komplain dikirimnya cuma satu ya jls satulah pilih varian nya aja yg 1 sunscreen keliatan dr ulasannya,netral
tahan lama bgt dan cocok bgt terimakasih seller,netral
beneran bagus tp sayang ga waterproff,positif
mantapu semoga cocok,netral
prdk sudah diterima packing dan pengiriman okeyterimakasih,netral
udah cocok banget sama cushion ini gak mau pindah ke lain hati terima kasih seller,netral
sudah langganan terima kasih bnyk buat bonus hair treatment nya bagus cocok bgt buat rambut sy,positif
lumayan berguna ada perubahan nya gampang di bilas,netral
sesuai dengan pesanan harga bagusss,positif
barangnya bagus pengiriman cepat,positif
liat bintang saja saya sebenernya gak pengen komen biar pembeli lain lihat bintang saja karena saya males ngetik tetapi apabila saya tidak ngetik nanti pembeli lain tid,netral
thhank youuu top bgtt,netral
baguss bangettt ccok banget di mukaku yg berminyak,positif
paling cocok dengan eyeliner ini sudah beli bebeapa kali product ini pengiriman lebih cepat dari perkiraan,netral
barang bagus original kualitas lumayan serta packing rapih dan pengiriman cepat,positif
terima kasih giftnya barang dikirim sesuai dengan pesanan,netral
mntap setelah seminggu pemakaian terasa wajah semakin terjaga dan mulus,netral
akhirnya paketnya yang ditunggu tunggu datang juga bagus sesuai dengan pesanan ga ada yg salah bagus minyak wangi nya gada yg pecah aman baru pertama kali nyobain varian,negatif
respon cepet pengiriman cepet suka banget sama warnanya biasanya saya pake lip cream tapi lipstik ini tekstur nya lembut bikin lembab bibir pokonya luv banget,netral
warnanya bgs dirambut rambut tdk jd kaku pengiriman cpt mksh,netral
sebener nya keputihan untuk tone up muka aku tapi pas di pake lama kelamaan kaya nyatu gitu ke muka jadi ga bikin abu2 keren pokonya mantap,netral
ini masker yg paling bagus banget buat kondisi wajah aku yg kusam pengirimannya juga cepet terimakasih,positif
barang sampai dengan aman dan selamat hehe goodjob,netral
niceee,netral
baru pertama coba semoga kulit kering ku terbantu,netral
kualitas produk baik wangi ini paling favorit dan awet sekali pengiriman cepat dan packaging aman,negatif
cocok,netral
suka dengan wanginya dan membuat tangan kaki jd halus dan lembab,netral
masyaallah bagus dan bikin wajah ku adem seharian terutama sedang diluar tuh kena sinar matahari pun malah jadi adem,positif
barang sudah sampai sesuai pesanan dan wangiiiii banget dapet harga lagi diskon pula pengemasan juga sangat aman bagus banget tempat parfumnya terima kasih,negatif
parfum datang dgn aman packaging nya pun ajib wangi nya suka bnget,negatif
sesuai pesanan packing aman bgt ngga pecah pokoknya aman udah ke pakai itu ada kek kegores grgr kuku ku sendiri,netral
packing rapi pengiriman aman,netral
cepet bgt sampe nya sehari order lgsung sampai dan dpt hrg 53 makasih scarlett,negatif
pesan tgl 30 sampainya tanggal 11 lama banget pengemasannya juga lama banget untuk official store ya,netral
shadenya bagus banget di bibir truss tahan lama dan ga bikin bibir kering,positif
barang original kualitas barang bagus kecepatan pengiriman standar seller gercep harga okay,positif
harga bersaing produk bagus diskon terus dong,positif
produk bagus harga bersaing kurir cekatan,positif
produknya bagus pengiriman cepat packaging rapih bonus tester juga thank you seller,positif
varian garden of whisper aroma segar vanila bunga ada aroma manis pokokx dach thank you seller gbu,negatif
kerrrennn produks bagus original dan sesuai deksripsi cocok untuk kulit kering,positif
sudah diterima kualitas produk sangat baik kecepatan pengiriman sangat baik,netral
bagus wangi nya enak dtng nya jg cepat,negatif
sangat aman kemasannya dan original cocok untuk anak kecil san aman,netral
murah dan cepat sampai,netral
box nya sultan bgt ada box kecil nya juga di kemas 1 1 tapi dah di robek ma bocil wangi enak bgt seger suka bgt ma wanginya recommended trimakasih,negatif
outdoor juga merupakan bagian dari genus onthophagus dan familia bombyliidae yg mau difollow rt aja jfb,netral
pengiriman cepat wangi bgt pertama x coba parfum ny scarlet,negatif
puas dan tepat waktu,positif
respon penjual baik pengiriman cepat pesanan sesuai packing rapih cocok dgn produk ini udah pakai bertaun taun,netral
harga promo produk ori pengiriman cepat,netral
recommended seller,netral
barang tiba dengan baik sesuai orderan packing aman dan baik pengiriman cepat,netral
diterima dengan baik pengemasan oke pengiriman cepat dan hasilnya sesuai dengan ekspektasi,netral
cocok untk kombinasi,netral
jzjsnsnsndnndnxndndnddjdjjdjdjdjdjdjdjdjdjdhdhdbddh,netral
selalu beli minyak wangi ini karena baunya khas bgt dari dulu jaman sekolah,netral
my favv always cakep bgt buat ombre,netral
ringan sprti tdk pakai apa agak ngurangin beruntusan jg,netral
alhamdulilah dah sampe produk sangat bagus packaging sangat rapi tidak pecah mks pol harum,negatif
gk ada yg kecewa produk bagus saya dah langganan td saya mw klik smua bintang nya tp dah keluar duluan aplikasi nya,positif
ook,netral
bagus serumnya real juga efeknya pori2 yang besar agak tersamarkan dan kulit jadi halus terimakasih ya,positif
barang sesuai pesanan pengemasan cukup baik pengiriman cepat,netral
baru mau coba fw sama moisturizer nya sih cocok,netral
aku suka produk garnier karena cocok sm muka aku bahannya ringan dan mudah di serap semoga produknya sll the best ya sll amanah dan aman produknya,netral
warnanya bagussss,positif
kuasnya melengkung jadi pas diambil dari wadahnya harus pelan pelan supaya ga patah,netral
produk ini membantu meratakan warna kulit sekaligus membuatnya terasa lebih halus dengan ukuran 20ml kemasannya terlihat praktis dan mudah digunakan sehari hari,netral
aluminium foil nya susah dibuka,netral
bagus warna nya,positif
cocok eyeliner make over krn tahan lama,netral
