cleaned_text,Label
plis ini longlasting banget warnanya juga bagus banget bgt kalo di ombre in sama skye best combo teksturnya jg ringan will b my fav lip product,positif
respon seller ok bgt jg pengiriman nya kilat malam order bsk sore lsg sampe makasih,netral
produk seauai,netral
recommended ya aroma parfumnya ada kopi2 nya gitu lumayan tahan sekitar 12 jam an dan wanginya beda aja botolnta mungil bisa masuk dalam tas kecil sekali pun terimak,negatif
pengemasan aman pengiriman sesuai dengan perkiraan barang baru pertama kali coba semoga cocok,netral
wangi nya freshhh pas di semprot agak nyegrak tapi kelamaan jadi enakk lumayan tahan lama udah kedua kali nya beli disini next kalo ada diskonan mau beli varian lain hehe,negatif
baguus masih tersegel ori rekomendasi thank,netral
cocok pakai make over tidak kering tahan lama,netral
mksih sudah diterima dalam keadaan yg baik exf masih lama 0727 jadi aman,netral
udah repurchase yang ke 2xnya udah cocok di rambut ngurangin rontok terus bikin cepet panjang juga dapet harga promo cuma 1rban,netral
produk nya bagus cocok untuk laki laki maupun perempuan harga ok delivery cepet,positif
ori azarine tp cair,netral
mantep pengiriman cepet,netral
sunscreen favorite pokonya,netral
barang sesuai pesanan packing aman pengiriman lumayan cepat wangi banget parfumnya tahan lama juga mantap scarlet bakalan order lg nih parfumnya toko juga amanah goo,negatif
sebelumnya order var velvet tapi sudah habis karena sering dipakai sekarang sweet memories enak banget wanginya manis harganya lebih murah di olshop dibandin,negatif
tekstur ringan mudah menyerap di kulit palayanan cepat terima kasih,netral
teh nya cocok,netral
langganan terus sama scarlett beli pas 6 6 harga murah proses cepat ed masih lama dijamin keasliannya pengiriman cepat kurir ramah makasih tiktoksho,negatif
belum di coba mudah mudahan cocok di kulit anakku,netral
barang datang sesuai pesanan waktu beli dapat harga diskon jadi lumayan sudah cocok banget pakai micellar water ini semoga bisa langganan di toko ini,netral
udah pembelian yg ketiga kali cocok banget dikulitku yg bentar2 jerawatan semenjak pake ini jerawat cepet kempes,netral
sudah sampai tonernya packing aman terimakasih,netral
sesuai order proses cepat packing rapi dan aman,netral
barang sesuai deskripsi packaging rapi dan pengiriman juga cepat,netral
baru mau nyoba cleanser dr somethinc semoga cocok dapat tester serum jg lg terima kasih,netral
kemasan mewah pengiriman cepat kualitas barang bagus,negatif
produknya original dan packagingnya rapih dan aman,netral
pengiriman barang sesuai estimasi waktunya produk sesuai order seller ramah gercep,netral
barang sudah terima ini pemakaian ke 2 karena produknya bagus kulit wajah jd cerah dan lembab barang ke terima sesuai jadwal di kasih bonus pula terima kasih some,positif
nyc,netral
wangi manis floral elegan enakk bangettt dpt free body serum travel pack thank you scarlett,negatif
terimakasih pesanan sudah sampai maaf terlambat kasih ulasan,netral
kemasan oke pengiriman cepat untuk harga ya relatif lah ya untuk pemakaian rutin istri,netral
,netral
ini serius stiker d botol g ada botol polos lho ini asli gak sie jd ragu ak udh prnh beli velvet sm euphoria smua ada stiker d botol ko ini polosan,negatif
susah untuk keluar serumnya tutup yg didalam sudah dibuka keluar serumnya tp hanya beberapa tetes dipencet kaga keluar dicokok pun kga keluar akhirnya dibuka botoln,netral
ada garansi produk diterima minimal 1thn sblm exp lah ini aku dapet yg 2 bln lagi mau expired mau retur juga buang2 waktu doang pelayanan mengecewakan,netral
1 pecah ngk ada isi nya sma sekli,negatif
tidak sesuai gambar,netral
kdodf f nfifoorrjr d fnkwkdkfkdnddn f f fcccsjskiddj ksosifjd ssodkkfjfw kwkdbdbcj d sodofof kwkskdkdkddiso fkcovogene ekkdf flekdkndbdowkdd f kdod,netral
cepat bgt kiirmnya sesuai pesanan sukses selalu,netral
pengiriman barang cepat banget packing aman and tentu ori,netral
respons penjual dan pengiriman cepat pengemasan produk aman dan dalam keadaan sangat baik,netral
wanginya yg lembut membuat saya nyaman ketika dipakai,netral
pesanan sudah sampai dan sesuai,netral
okeee siiipp makasiiihhhh klo boleh kasih masukan kemasannya jgn terlalu mahal lah itu kayanya mahal kemasannya ya hehe,netral
barang original harga affordable pengiriman cepat,netral
cocok dengan jenis kulit saya ini selalu berlangganan,netral
wanginya enak beli karena review dokter kulit yg katanya aman dan tdk mengandung bahan yg berbahaya utk kulit cocok dg kulitku thanks seller pembelian yg kebelasan,netral
bahannya ringan sensitif dan kering bagus tidakk,positif
barang dikirim sesuai deskripsi pengiriman cepat kualitas asli packing baik dan rapi,netral
alhamdulillah paket dah sampai dengan baik sesuai dengan pesanan wanginya enak bgt manis dan harum,negatif
terima kasih,netral
pas buka yg aroma sweet memories kirain botol ny polosan eh tak tau stiker ny pindah posisi,negatif
pas untuk kulit saya berhubung sering aktivitas outdoor barang cepat sampai,netral
produk baik packing rapi proses cepat seller ramah,netral
wanginya strongg tapi soft enakk banget,negatif
kulit menjadi bersih berkilau lembut dan segar,netral
packaging kurang tebal produk pecah begitu dibuka dari kemasan,netral
cocok tahan lama warna sesuai,netral
terima kasih sudah sampai dengan aman dan sesuai packing dan pengiriman baik,netral
cuhsion skintific ringan gampang menyerap memang the best,netral
produk sesuai pesanan dan cepat sampai,netral
sudah cocok dengan produk ini kulit terlihat lebih cerah,netral
anak saya cocok pakai ini sehingga saya nyetokin 110 ml dapat free sample size pula ekspirednya masih lama packing aman pengiriman cepat,netral
belum dipakai jd blm tau masuk ga nya ke ram but yg pasti pengiriman cepat,netral
barangnya sudah sampai sesuai pesanan packingnya juga bagus dan aman recommended sih beli di sini tokonya gercep cepat sampai paketnya,positif
produk mantap terimakasih cepat jg pengiriman nyaa,negatif
suka sama bedaknya hasil akhirnya keliatan smooth ga cakey dan ga berat di muka bakal repurchase lg sih ke depannya,netral
banyak yg blng sebagian besar varian wanginya kaya bapak bapak tp yg ini engga kok enak malah awal disemprot fresh banana orange gitu lama lama jd agak sedikit warm mu,negatif
pengiriman nya cepat packingnya bagus produk nya ok terimakasih sering promo discount yaaaaaaa,positif
pengiriman cepat klo pipi klo ada jerawat pakai ini makasih ya kak,netral
aman cepat dan cocok,netral
mantap aman,netral
bagusss bangetttt sumpah beneran waterproof trs packaging nya juga sangatt aman bangettt di bonusin serum something nya jga malahhh aaaaarrhhh tngkyuu something muac,positif
pesanan nya sdh sampe ini wangi kesukaan ku bangetz lembut trimakasih reseller trimakasih tokped pengiriman ok,netral
barang sampai dengan aman kemasan rapi dan pengiriman cepat tanggal kedaluarsa masih lama dan sejauh ini cocok pakai somethinc,netral
sunscrennya bagus cepet meresap dan ringan,positif
enak banget setelah pemakaian 3 kali langsung keliatan hasilnya meskipun pas pengaplikasiannya lengket tapi hasilnya oke,netral
skintific bagus bgt buat muka berminyak,positif
bagus bgt,positif
suka banget sama warnanya cocok di kulit aku dan juga wanginya enakk kaya wangi coklat warna packagingnya juga cantik bgt tapi sayang ini gampang transfer karena,netral
produk tidak sesuai pesanan mohon dilakukan penukaran dan kirimkan ulang,negatif
maliogoro jl mh thamrin no 109 113 ledok kulon tiga ledok wetan kec bojonegoro kabupaten bojonegoro jawa timur 62113sophie turner boomchallengeasepso 1,netral
warna ini d bibir saya lebih gelap teryata jd seperti warna coklat kehitaman,netral
bagus bangettt muka ga jadi kering atau ketarik,positif
paket sampai cepat packing rapih dan tidak ada yg bocor,netral
sesuai dengan yang diiklankan exp date masih lama kemasannya msih blink2 seperti dulu mungkin bisa dikembangkan untuk anak usia tanggung spt remaja atau anak2 di atas,netral
tidak cocok di wajah aku bikin muncul jerawatan,netral
pesanan saya dgn aman tapi ternyata setelah 1 minggu pemakaian ternyata gak cocok muka saya bruntusan,netral
bagus cuma cepet patah stick lips nya,positif
terima kasih barang sampai dgn selamaat dapet bonus sunscreen dan serum juga yaampun baik sekali smg rezekinya semakin byk minn,netral
wanginya enak kyk wangi bayi gtu packagingnya mantep bgt bubble wrapnya banyak dikasih kardus juga semoga cocok di aku,netral
seller ramah fast respon juga,netral
bahannya ringan gampang diserap oleh kulit ga bikin lengket cocok untuk kulit sensitif,netral
kualitas produk bagus belum nyoba tapi semoga aja suka,negatif
oyla anda t r igedi denem k l mdese dem tabalmai neden oyan sen tek eles bu men emes sen tek eles zhanyma daua sen ma an aua sen tek eles bu men emes zhanyma daua se,netral
mantap top sesuai desk cocog wangi mantap,netral
isinya asli emang selalu pake ini dan cocok,netral
belanja 200ribu kurang dikit dapat bonus serum seharga 90ribuan giliran belanja hampir 400ribu gak dapet bonus apa2 suka bingung saya tapi makasih yaa,netral
cocok dengan kulit ga bikin jerawatan baru pertama kali coba sempat khawatir alhamdulillah aman flawless tidak bikin crack,netral
yang velvet rauge wanginya enak banget di pke pas hangout cocok juga jdi pengen koleksi semua wrna,negatif
pengiriman nya cepet banget pesan jam 7 malem dateng besok nya jam 3 sore excellent,netral
mantab,netral
paket rapi sesuai pesanan pengiriman cepat pelayanan memuaskan terima kasih mustika ratu,netral
pertama coba parfum scarlett dapet harga 36rb dong untuk harumnya vanilla tapi seger gtuu bakal beli yg lainnya jg semoga tahan lama baunya,negatif
wanginya strong manis baru nyobain sii varian wangi ini buat yang suka aroma manis ini cocok sii boleh nyobain,negatif
paling ok buat gigi aku yg sensitip terima kasih mustika ratu sukses selalu,netral
admin fast respon pengiriman cepat barangs sesuai belum nyoba untuk efeknya di wajah,netral
pengirimannya cepat,netral
produknya ga ada masalah tapi dus nya sudah di bongkar dn paketnya dtang lama,netral
barang ori dr dulu udh pake make over varian shade ini bagus bgt plis make up tahan lumayan,positif
wangi bahan herbal produk dr mustika ratu sdh dikenal jaman dulu kala pengalaman sy kira2 3 th produk ini bs menumbuhkan rambut2 halus disekitar kening bagian atas trim,netral
wangi cepat sampai terimakasih,netral
utk packing nya aman bgt wlaupun box nya penyot tp isi dlm nya aman bgt terimakasih kak fell suka bgt sm aroma sweet memories ini manis buah segar dan vanila gt,negatif
gak pernah kecewa belanja disini selalu puas,positif
warna ini kurang cocok di saya jadi kayak manusia silver btw enak dipakenya ga terlalu nempel harus sering apply lagi,netral
perih dipake ke wajah,netral
barang nya datang sangat cepat tapi belum bisa ngasih review soalnya baru mau cobak,netral
bahannya ringan dan mudah diserap kulit sangat cocok untuk kulitku yang cenderung berminyak membuat make up tahan lama pengiriman barang sangat cepat,netral
bagus banget tahan lama,positif
thanks for free sample,netral
alhamdulillah order sesuai pesanan teksturnya lembut warnanya jg cocok buat kulit aq makasih ya,netral
thanks barangnya usah sampai packingan rapih barang ori harga murah dan kurirnya juga ramah mantap pokoknya bintang 5 deh buat resselernya thanks next akan bel,netral
flash sale skintific banyak dramanya,netral
produk dikirim dalam keadaan baik wangi elegan isinya biasanya full kak ini kok gak full kurang dikit sih hehehe tp gapapa aku beli di harga cuma 40ribuan thanks y,negatif
bahannya ringan gampang di serap ori semoga cocok,netral
wangi nya mantap tahan lama banget wangi nya cocok banget di aku,negatif
produk dan pengemasannya bagus sekali respon penjual sangat cepat pengiriman cepat dan kurir juga sangat baik dan informatif recomended,positif
bahanya ringan,netral
pengiriman cepat datang sebelum estimasi waktu packing bagus barang sampe dengan selamat belinya cleansing balm dan calm down bonus serum dan ss makasi something se,positif
pengiriman cepat packing aman barang ori mantap thanks,netral
respon cepet packing ok semoga kulit bisa kinclong,netral
wanginya ga enek seger semua aku udh habis 3 menurut ku ini wanginya tahan lama bgt seharian malah i love u so much scarlett,negatif
makasi,netral
tidak aman 1 dust susut perut sudah terbuka,netral
seller responsif pengiriman standar packaging baik barang diterima dalam kondisi baik sesuai dengan deskripsi terimakasih,netral
barang asli real pic mau di bawa ke ln ini beli banyak ha ha packingnya rapi dan aman kurirnya juga baik terima kasih seller dan tokped sukses selalu,netral
terima kasih,netral
barang sesuai pdhl harga 5rb ga nyangka bisa dpt suncreen azarine 40ml,netral
paket sampai dengan selamat expired masih lama,netral
baru mau coba semoga cocok seperti produk2 azarine yg lainnya packing rapih sehingga paket tiba ditujuan dgn aman,netral
cepat sekali proses dan pengirimannya happy dpt bonus thanks ya,netral
ini pembelian kedua karena merasa cocok di kulit,netral
baguss bangettt meredakan jerawat gua tapi wort to buy sii,positif
semogaa cocokkkkkk hehehe dikasih free serum kecik,netral
bahan enak mudah menyerap di kulit tidak bikin iritasi murah juga harganya,netral
karena penasaran ama wanginya akhirnya cek out yg varian banana fusion dan trnyata mmg segeeer manis susu ada aroma pisang dan kemasannya unik beda dengan varian y,negatif
baru pertama pakai skintone aku neutral medium disaranin sama beauty consultantnya pilih shade buttermilk adminnya ramah responsif packing aman pengiriman cepat th,netral
cocok banget pake ini tekstur bedaknya halus cepet nge set nya tahan lama,netral
alhamdulillah paketnya sudah sampe meskipun sedikit lama pesen tanggal 4 desember sampe 8 desember tapi paketnya sesuai packingnya aman jadi barangnya ndak ada yg rusa,netral
kita suka wanginya,netral
paket datang peking aman ada dus besar nya juga di jamin anti pecah cinta banget sama wangi nya mksih toko semoga lancar terus usaha nya amin,negatif
barang diterima sesuai pesanan dan dalam kondisi baik,netral
bagus bgt ringan di bibir dateng nya cpet toko amanah,positif
respon seller cepat barang sangat sesuai deskripsi recommended seller,netral
baru mencoba warna lucu2 dan senang banget belanja disini cepat y,netral
packing super aman cocok di muka gue selalu repurchase pengiriman juga cepat,netral
trimakasih paket sudh tiba dengan selamat semuga bisa beli lagi aromanya pas mewah elegan saya suka pokonya ngak nyesell dech kualitas produk asli bagus sa,negatif
cocok sama kulit ku tekstrur smooth,netral
pengiriman cepat wanginya jg enak saya suka,negatif
dikemas dengan baik produk sesuai pesanan dan exp nya masih lama cocok dengan produk ini,netral
kecewa banget botol parfumnya bocor kecewa beratttttt bocorrnya meberr,negatif
barang cocok ok banget,netral
smudgeproof pake dr pagi sampe malam masi oke,netral
bagus bgt glossy dan lumayan tahan lama,positif
barang datang sesuai pesanan barangnya original mantappp,negatif
barang sampai dengan aman semoga cocok di aku terima kasih untuk bonusnya,netral
gk salah pilih ini mah wangi nya aq suka pas live promo dpt 37rb mantab parfum nya next order lagi mau koleksi parfum2 scarlet thank s,negatif
warnanya cocok buat di tan skin teksturnya di awal sedikit lengket tahan lama,netral
suka banget sama warnanya ga perlu pake bedak lagi udh cantik,netral
barang bagus kualitas bagus pengiriman cepat dan memuaskan suka dah pokoknya terima kasih,positif
suka bgt sama ukuran bigger size ini suka bgt sama ukuran bigger size ini,netral
kualitas produk barang ori sesuai pesanan dpt bonus dtg juga cepat pengemasan nya mantap,negatif
barang sesuai foto dan deskripsi cocok untuk kulit sensitif pengiriman sangat cepat,netral
wanginya enak,netral
bibir berasa lebih sehat packing simple tapi elegan,netral
sesuai pesanan pengiriman cepat respon seller ok,netral
dpaet harga diskon plus free sunscreen dan serum sachet,netral
sudah sering pake cocok utk kulit normal spt saya terimakasih mustika ratu,netral
teksturnya lembut dan ringan diaplikasikan dan awet menempel di kulit wajah,netral
pesanan dibungkus dengan sangat aman rapi kualitas oke no kw,netral
respon cepat pengiriman cepat,netral
harga murah packing sangat aman pengiriman cepat,netral
bedak nya hancur tumpah berhamburan sampai dikemasannya,netral
dapet harga 20 rb gokil banget jujur ga pikir panjang langsung co eh pas liat review banyak bad review akhirnya ga berharap banyak ehhh taunya ini bener bener wor,netral
bagus nyatu ama kulit tahan lama matte,positif
kualitas mustika ratu lokol tea dan pelayanan sirclo memuaskan,netral
proses pesanannya sangat cepat lumayan dapat harga murah karena ada voucher toko terima kasih next bakalan belanja lagi,netral
seller ok produk ok cocok smooth n clean pengiriman cepat recommended thank you,netral
diterima dengan baik barangnya baru mau nyobain jadi belum bisa kasih review apapun mungkin bakal dicoba dulu 1 bulan efektif enggaknya,netral
product quality baik sumpah baunya wangi bgt wangi bunga mewah segar,negatif
beli kedua kalinya dengan warna berbeda krn suka ama yg pembilan yg pertama,netral
barang sudah diterima dengan baik packing oke,netral
pengiriman cepat produk bagus ga bikin cakit,positif
cepet banget pengirimannyaaaa aku sukak dari awal rilis udah penasaran sama warna make over pink ini krn menarik banget tipe bibirku yg atasnya gelap bawahnya eng,netral
masalah dengan pengiriman saya pesen same day delivery dari 2 hari sebelumnya dan sampenya hari ini jadi saya harus bayar ongkir utk kirim produk dari rumah ke kantor,netral
alhamdulillaah cocok utk kulit kering memperhalus dan mencerahkan makasih banyak ya untuk bonusnya,netral
no white cast adem dipakai no sticky on face waterproof barang ada segelnya exp date masih laaamaaaa thanks btw,netral
pengiriman cepat dan packaging sangat aman cushion nya juga bagus overall memuaskan,positif
barang sesuai pesanan wangi,netral
warna na sesuai harapan tahan lama dan lembut di bibir,netral
demi apapun wangi bangettttttt pengirimannya cepet bangetttttt suka bangettttttttttttt packingnya aman bangetttttttttt berlapis lapis bujeeettttt mana harganya murah,negatif
wanginya,netral
favorit tekstur nya bagus pelayanan bagooosa,positif
barang sampai dengan aman terimakasih,netral
bagus tekstur ringan nggak bikin kulit jadi berminyak dan bikin make up tahan sampai 8 jam nggak geser,positif
goooood,netral
sdh biasa pakai serum somethinc baru mau coba biospicule semoga cocok,netral
homestay view pegunungan di batu ada kolam renang taman bermain cafe juga perhari 160rb whatsapp skr jadi ascent cafe hotel kak namaya nyamy girlfriend,netral
pengirimannya cepet banget sehari sampe packingnya rapih dan aman semoga produknya cocok,netral
pengiriman cepat barang sampai dengan selamat tidak ada lecet dapat di percaya mudah amanah terpercaya,netral
kualitas produk the best makasih orderanku sudah sampai dengan selamat baru kemaren pesen harga ini udah nyampe seperti biasa wanginya istimewa makasih juga,negatif
parfum sprtinya bocor krg rapet atau gmn box nya basah bau parfum isinya pun jd ny g penuh,negatif
barang sesuai pesanan pengiriman cepat dan aman barang sampai dengan selamat terima kasih,netral
terimakasih barang datang,netral
toko recomended kemasan rapi harga recomended kualitas recommended,netral
maaf banget harus kasih bintang 1 karena ga dateng barangnya kurang beli 190 kurang barang 1 wkwkwk makasih,netral
terima kasih barang sdh diterima dg baik pengiriman cepat sekali packing aman ada bublewrapnya semoga produknya bagus dan tahan lama blm dicoba dpt harga murah selle,positif
cocok untuk kulit aku bagus banget lah pokoknya,positif
alhamdulillah cocok dg garnier micellar water bisa angkat make up dg bersih sering2 promo yaaa,netral
baru nyoba mudah2ancocok,netral
packing aman dan rapi barang original fan murah,netral
barang sesuai belum dicoba tapi semoga cocok,netral
pengiriman ok packaging ok kondisi produk ok kualitas produk ok terima kasih,netral
uda kesekian kalinya order disini dan recomend banget barang sampai dengan aman,netral
thank you baranh sudah diterima belum di coba tp percaya pasti ketjeeeh,netral
sesuai pesanan,netral
wangi bangett dan tahan lama pantes yaa scarlett varian velvet ini bnyak yg diminati terimakasih nnti mau order warian lain ah recommend sih ni wanginya soft gtu ga b,negatif
produk berkualiatas dgn harga spesial jika membeli via toped sdh pakai teratur dan membuktikan sendiri gak akan pindah ke lain hati thank you,netral
oke,netral
lembut tidak lengket cocok utk kulit kering terima kasih,netral
it is good for my skin i feel very refreshed as well after using this product,netral
ringan ga bikin kusem cocok buat kulit kering sesuai sama klaim nya,netral
bagus masuk ke kulit saya and waktu pengiriman cepat god job lokonya,positif
pembungkusnya robek tdk tertutup rapi dan di dalamnya sepertinya tumpah krn basah pembungkusnya basah sepertinya bukan krn huna tpi krn bocor micellarnya krn bau mica,netral
bagus banget sunscreeennya gak whitecase juga pengiriman cepat,positif
barang uda sampai packing rapi benget di bubble lagi suka sama sellernya,netral
sesuai pesanan sdh pembelian kedua terima kasih,netral
oke mantaaaaabs sesuaaai expetaasih barang,netral
alhamdulillah segar dan tidak mengandung fluoride jadi tenang,netral
parfum variant ini yg paling aku syuka terimakasih yaa,negatif
harum banget langsung dipakai ini,negatif
kualitas produk nice scentnya enak fresh fruity floral dikit nyampe nya juga cepet worth it scentnya mantap wkek,negatif
pengiriman cepat packing oke tp blm dicoba semoga cocok trmksh,netral
ringan membuat wajah lembab keesokan harinya,netral
cocok syuka the best,netral
nice,netral
parfum jolly sudah sampai pengiriman cepat pakingan tidak diragukan lagi sangat rapi parfum scarlet semua varian dan produk yang lain juga bikin jatuh cinta sich pokokny,negatif
alhamdulilah brang diterima dengan baik next ordel lagi mkasih,netral
puas banget dikirimnya cepat cuma 2 hari sampai lalu dapat bonus suncreen 15ml lagi,positif
alhamdulillah paket sudah sampai aman sesuai pesanan akhirnya nemu rangkaian hair care yg cocok dan ramah dikantong setelah pencarian hair care untuk rambut,netral
mantap packing bagus barang selamat kurir istimewa,positif
barangnya udh d ambil sama temen krn titipan,netral
alhamdulillah sudah sampai dgn selamat semoga berkah tq in advance,netral
tahan 2 3 jam an dlm ruangan,netral
baru pertama nyoba semoga ccok ya tapi bagus pengemasan rapih i love it,positif
menghitamkan dan menguatkan akar rambut jd rambut tidak mudah rontok rambut jg terlihat lbh tebal dan berkilau,netral
akhirnya yg d tunggu2 dateng juga packing nya emg juaraaa ya pengiriman cepat wangi nya masyaallah kalem banget sebelumnya aku nyobain yg dreamy juga enak,negatif
pertama kali nyoba make over semoga worth it sama harganya,netral
nyobain yg kecil trus cocok ternyata di kasih bnyk freegift makasih bangettt,netral
layanan pengirimannya cepet pengemasannya jg rapih belum pernah pakai tp reviewnya bagus jd pengen nyoba deh diketerangannya spf 50 dan efek sejuk di kulit semoga c,positif
packing aman msh blm sempat coba datang sesuai waktu,netral
warna bagus natural alami tekstur lembut lembab di bibir,positif
warnanya keruh tdk seperti biasa dan aromanya kerasa bau alkoholnya,netral
saya suka produk ini membuat rambut ku kuat dan tidak mudah rontok terimakasih,netral
barang cepat sampai kondisii baik,netral
ok bagus asli original membersihkan muka dengan bersih packingdan pengiriman cepat okelah,positif
moist kecintaankuu pas tau lagi promo langsung checkout dan ternyata dapet bonus serum juga thankyouu somethinc,netral
ada wanginya tapi masih bisa ditoleransi cocok jadi base make up,netral
paket sudah sampai dgn selamat cepat tepat terimakasih azarine semoga cocok,netral
mantul,netral
puas bgt blanja disini seller ramah n pengiriman cpt brg original next order lg makasi seller n toped,positif
gooooddd lumayan tahan lama,netral
brg oke,netral
dari bbpr varian wangi nya parfum scarlett paling suka si biru samudra wangi nya best sekali terimakasih,negatif
semoga cocok sm kulitnya seller recommended responsif,netral
toppp bangeett beli 3 barang dibonusin 2 jadi 5 dapet harga pas diskon lumayan banget packingnya juga topp banget aman kualitas jangn ditanya,netral
suka banget sama wanginya thanks seller bismillah berkah aamiin,negatif
sesuai pesanan makasih seller,netral
walaupun sempat nyangkut di pengirimannya tapi okelah produk sesuai yang dipesan,netral
kualitas produk aromanya manis perpaduan seger bunga cocok bnget buat cwe yg suka wangi floral suka banget sm parfum scarlett apalagi uda ada kandungan extra de parfumny,negatif
dapet diskon dong yeaaaay sesuka itu sama bedak ini,netral
sesuai pesanan n dilayani toped makin mantap,netral
cocok bagus di kulit akuu,positif
paket parfum dtg alhamdulillah gk ada yg bocor ataupun cacat dus parfum masih kesegel wangi nya bener awet semprot dri pagi sampe menjelang mlm masih kecium kurir ra,negatif
selalu pake moisturizer ini cocok dgn kulit sy yg kombinasi,netral
kualitas produk wangi nya tahan lama wangi nya enak dan ga bikin enek gitu,negatif
diterima dengan baik packing aman semoga ampuh,netral
bikin bibir tampak basah glossy warnanya cenderung subtle apalagi kl mirip warna bibir sekali oles sebenernya sdh cukup memberikan efek lembab,netral
pengiriman cepat barang ori warna nya bagus dan tahan lama sangat recommended,positif
tekstur ringan lembut cocok bagus hasilnya,positif
mudah bikin jerawat sama komede tertutup,netral
alhamdulillah sudah sampai paketnya tepat waktu karena sudah mau habis makasih seller,netral
dosnya penyok,netral
alhamdulillah udah sampe parfumnya dari boxnya ajh udah bagus banget packingan super rapih wanginya soft aku suka,negatif
wanginya seger,netral
padahal pas mau beli harus po 12 hari eeh ternyata gercep diproses pesanan sesuai dan cepat sampainya terima kasih,netral
paket sudah sampai semoga cocok,netral
